{
  "project_slug": "example-film",
  "subject": {
    "character_id": "traveler",
    "display_name": "The Traveler",
    "pronouns": "they/them",
    "reference_files": ["assets/traveler-primary.png", "assets/traveler-profile.png"]
  },
  "occasion": "A fictional demonstration of a handmade lantern walk.",
  "relationship": "A storyteller introducing a fictional character.",
  "intended_message": "Small acts of making and sharing can brighten an ordinary evening.",
  "facts": {
    "memories": ["The traveler once carried a paper lantern along a quiet path."],
    "details": ["The lantern is handmade from amber paper."],
    "personality": ["patient", "curious"],
    "interests": ["evening walks", "handmade objects"]
  },
  "supporting_characters": [
    {
      "character_id": "maker",
      "display_name": "The Maker",
      "pronouns": "they/them",
      "relationship": "A fictional friend who builds the lantern.",
      "reference_files": ["assets/maker-primary.png"]
    }
  ],
  "language": "English",
  "music": {
    "characteristics": ["gentle acoustic rhythm", "clear singable refrain", "warm sparse arrangement"],
    "tone": "Hopeful and intimate without imitating a named artist.",
    "target_duration_seconds": 60
  },
  "boundaries": ["No logos or visible writing", "Do not invent biographical details"],
  "consent": {
    "personal_details_provider_disclosure": true,
    "statement": "This example is synthetic and may be sent to the configured text provider."
  }
}
